mysql> create database rushitha1;
Query OK, 1 row affected (0.00 sec)

mysql> show databases;
+--------------------+
| Database           |
+--------------------+
| information_schema |
| mysql              |
| rushitha           |
| rushitha1          |
| test               |
+--------------------+
5 rows in set (0.00 sec)

mysql> create table student(id varchar(7),sname varchar(9),phno varchar(11));
ERROR 1046 (3D000): No database selected
mysql> use rushitha1;
Database changed
mysql> create table student(id varchar(7),sname varchar(9),phno varchar(11));
Query OK, 0 rows affected (0.06 sec)

mysql> desc student;
+-------+-------------+------+-----+---------+-------+
| Field | Type        | Null | Key | Default | Extra |
+-------+-------------+------+-----+---------+-------+
| id    | varchar(7)  | YES  |     | NULL    |       |
| sname | varchar(9)  | YES  |     | NULL    |       |
| phno  | varchar(11) | YES  |     | NULL    |       |
+-------+-------------+------+-----+---------+-------+
3 rows in set (0.05 sec)

mysql> insert into student(id,sname,phno)values(12,'shero',78654329);
Query OK, 1 row affected (0.06 sec)

mysql> insert into student(id,sname,phno)values(13,'shinchan',98543219);
Query OK, 1 row affected (0.05 sec)

mysql> insert into student(id,sname,phno)values(14,'nobita',67453310);
Query OK, 1 row affected (0.05 sec)

mysql> insert into student(id,sname,phno)values(15,'doremon',546377190);
Query OK, 1 row affected (0.06 sec)

mysql> select * from student;
+------+----------+-----------+
| id   | sname    | phno      |
+------+----------+-----------+
| 12   | shero    | 78654329  |
| 13   | shinchan | 98543219  |
| 14   | nobita   | 67453310  |
| 15   | doremon  | 546377190 |
+------+----------+-----------+
4 rows in set (0.00 sec)

mysql> update student SET phon='5467338810'where id=12;
ERROR 1054 (42S22): Unknown column 'phon' in 'field list'
mysql> update student SET phno='5467338810'where id=12;
Query OK, 1 row affected (0.05 sec)
Rows matched: 1  Changed: 1  Warnings: 0

mysql> select * from student;
+------+----------+------------+
| id   | sname    | phno       |
+------+----------+------------+
| 12   | shero    | 5467338810 |
| 13   | shinchan | 98543219   |
| 14   | nobita   | 67453310   |
| 15   | doremon  | 546377190  |
+------+----------+------------+
4 rows in set (0.00 sec)

mysql> alter table student ADD age varchar(10);
Query OK, 4 rows affected (0.08 sec)
Records: 4  Duplicates: 0  Warnings: 0

mysql> select * from student;
+------+----------+------------+------+
| id   | sname    | phno       | age  |
+------+----------+------------+------+
| 12   | shero    | 5467338810 | NULL |
| 13   | shinchan | 98543219   | NULL |
| 14   | nobita   | 67453310   | NULL |
| 15   | doremon  | 546377190  | NULL |
+------+----------+------------+------+
4 rows in set (0.00 sec)

mysql> rename table student to student1;
Query OK, 0 rows affected (0.05 sec)

mysql> select * from student1;
+------+----------+------------+------+
| id   | sname    | phno       | age  |
+------+----------+------------+------+
| 12   | shero    | 5467338810 | NULL |
| 13   | shinchan | 98543219   | NULL |
| 14   | nobita   | 67453310   | NULL |
| 15   | doremon  | 546377190  | NULL |
+------+----------+------------+------+
4 rows in set (0.00 sec)

mysql> select user,Host from mysql.user;
+------+-----------+
| user | Host      |
+------+-----------+
| root | localhost |
+------+-----------+
1 row in set (0.02 sec)

mysql> create user 'shero'@'localhost'identified by '1234';
Query OK, 0 rows affected (0.08 sec)

mysql> grant all privileges on *.* to 'shero'@'localhost';
Query OK, 0 rows affected (0.00 sec)

mysql> show grants for 'shero'@'localhost';
+-----------------------------------------------------------------------------------------------------------------------+
| Grants for shero@localhost
|
+-----------------------------------------------------------------------------------------------------------------------+
| GRANT ALL PRIVILEGES ON *.* TO 'shero'@'localhost' IDENTIFIED BY PASSWORD '*A4B6157319038724E3560894F7F932C8886EBFCF' |
+-----------------------------------------------------------------------------------------------------------------------+
1 row in set (0.00 sec)

mysql>